{
  "schema_version": "1.0.0",
  "pack": {
    "key": "retail",
    "name": "Retail",
    "version": "2.1.1",
    "description": "Same-store sales, GMROI, conversion, inventory turns \u2014 merchandising and store operations.",
    "default_calendar": "454",
    "default_currency_hint": "USD",
    "locale_hint": "en-US"
  },
  "coa_template": "coa.json",
  "kpi_definitions": "kpis.json",
  "driver_templates": "drivers.json",
  "report_layouts": "layouts.json",
  "gl_template": "gl_template.json",
  "group_rollup_maps": "rollup.json"
}
