{
  "schema_version": "1.0.0",
  "pack": {
    "key": "logistics",
    "name": "Logistics",
    "version": "2.1.1",
    "description": "Cost per mile, fleet utilization, on-time delivery, DSO \u2014 fleet and network operations.",
    "default_calendar": "12month",
    "default_currency_hint": "USD",
    "locale_hint": "en-US"
  },
  "coa_template": "coa.json",
  "kpi_definitions": "kpis.json",
  "driver_templates": "drivers.json",
  "report_layouts": "layouts.json",
  "gl_template": "gl_template.json",
  "group_rollup_maps": "rollup.json"
}
