{
  "schema_version": "1.0.0",
  "pack": {
    "key": "government",
    "name": "Government",
    "version": "2.1.1",
    "description": "Budget execution, encumbrance, program spend, timely close \u2014 appropriations and fund control.",
    "default_calendar": "12month",
    "default_currency_hint": "USD",
    "locale_hint": "en-US"
  },
  "coa_template": "coa.json",
  "kpi_definitions": "kpis.json",
  "driver_templates": "drivers.json",
  "report_layouts": "layouts.json",
  "gl_template": "gl_template.json",
  "group_rollup_maps": "rollup.json"
}
